{
  "actions": [],
  "created_at": "2026-01-09T20:33:02.433925+00:00",
  "decision": "continue",
  "gates": {
    "consent_required": false,
    "human_review_required": false,
    "strict_mode": false
  },
  "notes": "Policy order: B(Es) then A(Lambda) then C(T). ",
  "schema_id": "coherencelattice.control_decision.v1",
  "version": 1
}